{
  "$schema": "../schema/entry.schema.json",
  "name": "com.stackoverflow/stackoverflow-mcp",
  "title": "Stack Overflow",
  "description": "Search Stack Overflow's trusted technical questions and answers with OAuth — no API key setup required.",
  "version": "1.0.0",
  "websiteUrl": "https://stackoverflow.com",
  "repository": {
    "url": "https://stackoverflow.com",
    "source": "other"
  },
  "packages": [],
  "remotes": [
    {
      "type": "streamable-http",
      "url": "https://mcp.stackoverflow.com"
    }
  ],
  "x-wayland": {
    "tier": "builder",
    "categories": [
      "knowledge",
      "developer",
      "research"
    ],
    "tags": [
      "stackoverflow",
      "q-and-a",
      "developer",
      "search"
    ],
    "maintainerType": "official",
    "license": "Proprietary",
    "verifiedAt": "2026-05-27",
    "popularityRank": 65,
    "installRate": 0.16,
    "iconUrl": "icons/stackoverflow.svg",
    "brand": {
      "logoBackground": "#ffffff",
      "logoForeground": "#f48024"
    },
    "auth": {
      "method": "oauth2-byo",
      "providerName": "Stack Overflow",
      "providerSignupUrl": "https://stackoverflow.com/users/signup"
    },
    "toolGroups": [
      {
        "label": "Question Search",
        "count": 2
      },
      {
        "label": "Answer Lookup",
        "count": 1
      },
      {
        "label": "Tag Browse",
        "count": 1
      }
    ],
    "setupGuide": {
      "path": "guides/com.stackoverflow-stackoverflow-mcp.md",
      "estimatedMinutes": 1,
      "stepCount": 2
    },
    "platforms": [
      "macos",
      "windows",
      "linux"
    ],
    "minWaylandVersion": "0.8.0"
  }
}
