{
  "$schema": "../schema/entry.schema.json",
  "name": "com.replicate/replicate-mcp",
  "title": "Replicate",
  "description": "Run, search, and compare thousands of community models for image, video, audio, and 3D generation - Replicate’s official hosted MCP.",
  "version": "1.0.0",
  "websiteUrl": "https://replicate.com/docs/reference/mcp",
  "repository": {
    "url": "https://github.com/replicate/replicate-mcp",
    "source": "github"
  },
  "packages": [],
  "remotes": [
    {
      "type": "streamable-http",
      "url": "https://mcp.replicate.com"
    }
  ],
  "x-wayland": {
    "tier": "core",
    "categories": [
      "media",
      "developer"
    ],
    "tags": [
      "replicate",
      "image",
      "video",
      "models"
    ],
    "maintainerType": "official",
    "license": "Proprietary",
    "verifiedAt": "2026-06-13",
    "verifiedBy": "Wayland",
    "popularityRank": 101,
    "installRate": 0,
    "iconUrl": "icons/com.replicate-replicate-mcp.svg",
    "brand": {
      "logoBackground": "#ffffff",
      "logoForeground": "#000000"
    },
    "auth": {
      "method": "oauth2-byo",
      "providerName": "Replicate",
      "providerSignupUrl": "https://replicate.com"
    },
    "setupGuide": {
      "path": "guides/com.replicate-replicate-mcp.md",
      "estimatedMinutes": 2,
      "stepCount": 2
    },
    "platforms": [
      "macos",
      "windows",
      "linux"
    ],
    "minWaylandVersion": "0.9.0"
  }
}
