{
  "$schema": "../schema/entry.schema.json",
  "name": "com.figma/figma-mcp",
  "title": "Figma",
  "description": "Read Figma design files, variables, components, and Dev Mode metadata. Figma's official hosted MCP with OAuth.",
  "version": "1.0.0",
  "websiteUrl": "https://developers.figma.com/docs/figma-mcp-server/",
  "packages": [],
  "remotes": [
    {
      "type": "streamable-http",
      "url": "https://mcp.figma.com/mcp"
    }
  ],
  "x-wayland": {
    "tier": "worker",
    "categories": [
      "design",
      "developer",
      "productivity"
    ],
    "tags": [
      "figma",
      "design",
      "dev-mode",
      "ui"
    ],
    "maintainerType": "official",
    "license": "Proprietary",
    "verifiedAt": "2026-05-27",
    "popularityRank": 50,
    "installRate": 0.22,
    "iconUrl": "icons/figma.svg",
    "brand": {
      "logoBackground": "#ffffff",
      "logoForeground": "#f24e1e"
    },
    "auth": {
      "method": "oauth2-byo",
      "providerName": "Figma",
      "providerSignupUrl": "https://www.figma.com/login",
      "scopes": [
        {
          "name": "mcp:connect",
          "plainLanguage": "Connect Wayland to your Figma account so it can read design files and Dev Mode metadata."
        }
      ]
    },
    "toolGroups": [
      {
        "label": "Files",
        "count": 4
      },
      {
        "label": "Variables",
        "count": 2
      },
      {
        "label": "Components",
        "count": 3
      }
    ],
    "setupGuide": {
      "path": "guides/com.figma-figma-mcp.md",
      "estimatedMinutes": 1,
      "stepCount": 2
    },
    "platforms": [
      "macos",
      "windows",
      "linux"
    ],
    "minWaylandVersion": "0.8.0"
  }
}
